[
  {
    "id": "MEM-361-13",
    "position_title": "COMMUNICATIONS DIRECTOR",
    "office": "Rep. Jerry McNerney",
    "location": "California",
    "posting_date": "2012-02-13",
    "description": "California Democrat (Rep. Jerry\nMcNerney) seeks experienced communications director to develop and execute\naggressive long-term media and outreach plan.\n\nCandidate must work closely with the Member and staff.\nIdeal candidate would be politically astute and have a good sense of humor.\nDesired qualities include political communications experience and the ability to\nrespond to challenging situations quickly and strategically. This position requires\nnon-traditional hours and travel to the District.\nCalifornia (District) ties and Capitol Hill experience are a plus.",
    "responsibilities": [
      "Serving as chief spokesperson",
      "Successfully pitching stories and press events to both national and local media entities",
      "Responding promptly to media inquiries",
      "Effectively messaging policy and other priorities",
      "Maintaining an aggressive new media profile",
      "Preparing the member for live interviews",
      "Writing press releases, and producing op-eds, speeches, talking points, and franked mail"
    ],
    "qualifications": [
      "Excellent written and oral communication skills",
      "Strong editing and proofreading abilities",
      "The desire to work collaboratively with a team in a fast-paced environment"
    ],
    "how_to_apply": "Qualified applicants should submit a cover letter, resume and two writing samples to: McNerney.Resumes@mail.house.gov No calls or drop bys, please.",
    "salary_info": null,
    "contact": "McNerney.Resumes@mail.house.gov",
    "equal_opportunity": null
  },
  {
    "id": "MEM-356-13",
    "position_title": "Scheduler/Office Administrator",
    "office": "Freshman Midwestern Democratic Member",
    "location": "Washington, DC",
    "posting_date": "2012-02-13",
    "description": "Freshman Midwestern Democratic Member seeks an organized, detail oriented and energetic Scheduler/Office Administrator for a fast-paced, team-oriented Washington, DC office. Primary duties include structuring and managing the Member’s daily schedule; coordinating the Member’s travel and logistical details of meetings; handling the Member’s personal correspondence; fulfilling various administrative duties including prepare/process office payments, and ethics/disclosure compliance; and, working closely with other staff members in the district and in DC to facilitate meetings. Additionally, the Scheduler/Office Administrator will work to ensure smooth overall office operations. Applicants must have superior organizational skills, strong oral and written communication skills, and strong interpersonal skills, be able to multi-task and thrive in a fast paced environment, and have poise, patience and a good sense of humor. The successful candidate will be a discreet, politically savvy, self-motivated, and very organized with the ability to successfully interact with different personality types. Additionally, the successful candidate must be strategic thinker who can navigate competing demands to maximize the Member’s time and come to anticipate the Member’s needs.",
    "responsibilities": [
      "Structuring and managing the Member’s daily schedule",
      "Coordinating the Member’s travel and logistical details of meetings",
      "Handling the Member’s personal correspondence",
      "Fulfilling various administrative duties including prepare/process office payments, and ethics/disclosure compliance",
      "Working closely with other staff members in the district and in DC to facilitate meetings",
      "Ensure smooth overall office operations"
    ],
    "qualifications": [
      "Superior organizational skills",
      "Strong oral and written communication skills",
      "Strong interpersonal skills",
      "Ability to multi-task and thrive in a fast paced environment",
      "Poise, patience and a good sense of humor",
      "Discreet, politically savvy, self-motivated, and very organized",
      "Ability to successfully interact with different personality types",
      "Strategic thinker who can navigate competing demands to maximize the Member’s time and come to anticipate the Member’s needs"
    ],
    "how_to_apply": "Please email a resume and cover letter to Michigan05Jobs@gmail.com with “Scheduler/Office Administrator” in the subject line. Prior scheduling and administrative experience strongly preferred and Michigan ties a plus.",
    "salary_info": "This is not an entry level position and salary will be commensurate with experience.",
    "contact": "Michigan05Jobs@gmail.com",
    "equal_opportunity": null
  },
  {
    "id": "MEM-349-13",
    "position_title": "Communications Director",
    "office": "Florida Leadership House Democrat",
    "location": "Washington, DC",
    "posting_date": "2012-02-13",
    "description": "Florida Leadership House Democrat seeks highly motivated and experienced Communications Director to handle press, speech-writing and communications and messaging strategy. Candidates must have excellent writing skills, on-the-record press experience, strong political instincts, and new media experience. Candidates must thrive in a fast-moving, aggressive communications environment; be team-oriented, nimble, creative and strategic; and have a positive, can-do attitude. The Communications Director also develops working relationships with print, electronic and social media press as well as communications teams in other congressional offices and the Executive Branch to coordinate and execute the Member’s overall communication efforts. This position provides an opportunity to work for a highly engaged, energetic Member of Congress who has a successful record of improving the lives of women, children, seniors and fighting for the middle-class.",
    "responsibilities": [],
    "qualifications": [],
    "how_to_apply": "Please send resume to DCResumes@mail.house.gov. No emails, phone calls or drop-bys please.",
    "salary_info": "Salary commensurate with experience.",
    "contact": "DCResumes@mail.house.gov",
    "equal_opportunity": "Equal opportunity employer."
  },
  {
    "id": "MEM-346-13",
    "position_title": "Analyst",
    "office": "Democratic Congressional committee",
    "location": null,
    "posting_date": "2013-12-02",
    "description": "Democratic Congressional committee seeks experienced Analyst to advise on tax policy and economic issues, brief Members and write Committee materials on implications of federal economic changes and tax policies, and work with Congressional and outside experts on revenue options.",
    "responsibilities": [],
    "qualifications": [
      "Requires strong analytical and quantitative skills",
      "strong written and oral communication skills",
      "attention to detail",
      "the ability to work effectively under tight deadlines",
      "Graduate degree in related field and Hill experience preferred."
    ],
    "how_to_apply": "Email resume, two brief writing samples, and cover letter with subject line “revenue analyst” to revenue.analyst@mail.house.gov -- no phone calls or walkins.",
    "salary_info": null,
    "contact": "revenue.analyst@mail.house.gov",
    "equal_opportunity": null
  }
]