[
  {
    "id": "MEM-394-18",
    "position_title": "Staff Assistant",
    "office": "Republican Congressman",
    "location": null,
    "posting_date": "2018-11-05",
    "description": "Republican Congressman seeks Staff Assistant to manage day-to-day office operations, process flag and tour requests, and act as primary front office staff. Duties will include answering phone calls, greeting visitors, overseeing internship program, and ordering office supplies. Successful candidates must be professional and friendly, demonstrate ability to quickly address and solve problems, possess exceptional organizational skills and attention to detail, and be able to work quickly in a fast-paced environment.",
    "responsibilities": [
      "Manage day-to-day office operations",
      "Process flag and tour requests",
      "Act as primary front office staff",
      "Answering phone calls",
      "Greeting visitors",
      "Overseeing internship program",
      "Ordering office supplies"
    ],
    "qualifications": [
      "Professional and friendly",
      "Demonstrate ability to quickly address and solve problems",
      "Exceptional organizational skills and attention to detail",
      "Able to work quickly in a fast-paced environment"
    ],
    "how_to_apply": "Please send resume and cover letter to gopwesternjob@gmail.com. No walk ins or phone calls.",
    "salary_info": null,
    "contact": "gopwesternjob@gmail.com",
    "equal_opportunity": null
  },
  {
    "id": "MEM-388-18",
    "position_title": "Staff Assistant",
    "office": "Senior Democratic Member of Congress",
    "location": "District Office",
    "posting_date": "2018-11-05",
    "description": "Senior Democratic Member of Congress seeks an energetic, organized, creative, self-starter to join the District Office of her very active and visible constituent services staff.\n\nThe staff assistant is responsible for coordinating mail and casework distribution; answering the phones; and preparing letters of greetings, condolences and congratulations on behalf of the Member. Responsibilities may also include casework assignments if the District Director finds that the staff assistant can take on such work while paying the required attention to his/her already assigned tasks. The staff assistant also serves as intern coordinator by recruiting, training, scheduling and assigning duties.",
    "responsibilities": [
      "Coordinating mail and casework distribution",
      "Answering the phones",
      "Preparing letters of greetings, condolences and congratulations on behalf of the Member",
      "Casework assignments (if the District Director finds that the staff assistant can take on such work while paying the required attention to his/her already assigned tasks)",
      "Serving as intern coordinator by recruiting, training, scheduling and assigning duties"
    ],
    "qualifications": [
      "Bachelor’s degree",
      "Significant experience interacting with the public",
      "Excellent writing, and communication skills",
      "Candidate must be a resident of the District of Columbia or willing to move immediately to D.C., if hired."
    ],
    "how_to_apply": "Interested applicants should send a cover letter, resume, references and two writing samples to DC00.NortonResume@mail.house.gov .",
    "salary_info": null,
    "contact": "DC00.NortonResume@mail.house.gov",
    "equal_opportunity": null
  },
  {
    "id": "MEM-379-18",
    "position_title": "Senior Legislative Aide",
    "office": "U.S. Rep. Lloyd Doggett (D-Texas)",
    "location": "Washington, DC",
    "posting_date": "2018-11-05",
    "description": "U.S. Rep. Lloyd Doggett (D-Texas) seeks a Senior Legislative Aide with a minimum of three years of Hill experience. This is not an entry level position.\n",
    "responsibilities": [],
    "qualifications": [
      "minimum of three years of Hill experience",
      "Excellent written and oral communication skills required",
      "Advanced degree a plus",
      "Spanish ability a plus",
      "Texas ties are a plus though not necessary"
    ],
    "how_to_apply": "Send resume, brief writing sample, and three references to DoggettJobs@mail.house.gov. Use title on your email: Senior LA Position. No drop-ins please.",
    "salary_info": null,
    "contact": "DoggettJobs@mail.house.gov",
    "equal_opportunity": null
  },
  {
    "id": "MEM-375-18",
    "position_title": "Staff Assistant/Legislative Correspondent",
    "office": "Southern Republican Congressman",
    "location": "Capitol",
    "posting_date": "2018-11-05",
    "description": "Southern Republican Congressman is seeking a Staff Assistant/Legislative Correspondent to join a fast-paced, hardworking team. The ideal candidate will be detail oriented, well organized and must have exceptional interpersonal skills and excellent oral and written communication skills.\n\nResponsibilities include, but are not limited to answering constituent phone calls, greeting visitors, leading Capitol tours and assisting the staff by performing various tasks. This position requires an ability to multi-task, prioritize duties, and perform under pressure – all with a keen attention to detail. A car and Tennessee ties are required.",
    "responsibilities": [
      "Answering constituent phone calls",
      "Greeting visitors",
      "Leading Capitol tours",
      "Assisting the staff by performing various tasks"
    ],
    "qualifications": [
      "Detail oriented",
      "Well organized",
      "Exceptional interpersonal skills",
      "Excellent oral and written communication skills",
      "Ability to multi-task",
      "Ability to prioritize duties",
      "Ability to perform under pressure",
      "Keen attention to detail",
      "A car",
      "Tennessee ties"
    ],
    "how_to_apply": "Please send resumes to tngopapplications@gmail.com. Phone calls and drop-ins not accepted.",
    "salary_info": null,
    "contact": "tngopapplications@gmail.com",
    "equal_opportunity": null
  },
  {
    "id": "MEM-371-18",
    "position_title": "Legislative Director",
    "office": "Congresswoman Frederica S. Wilson",
    "location": "Washington, D.C.",
    "posting_date": "2018-11-05",
    "description": "The office of Congresswoman Frederica S. Wilson seeks a Legislative Director in her Washington, D.C. office. Responsibilities will include developing and implementing the Member’s legislative priorities, advising her on various issues, and managing the legislative agenda. A well matched candidate will have substantive legislative experience, strong academic credentials and proven leadership and organizational skills. Moreover, the candidate should possess excellent oral and written communication skills, strong editing and proofreading skills, the ability to work well under pressure, an extensive knowledge of the legislative process, and the availability to work long hours.\n\nThis is not an entry-level position; only candidates with previous Hill experience and proven knowledge of legislative and political processes will be considered. Law degree, previous capitol hill experience in a leadership position and Florida ties are strongly preferred.",
    "responsibilities": [
      "Developing and implementing the Member’s legislative priorities",
      "Advising her on various issues",
      "Managing the legislative agenda"
    ],
    "qualifications": [
      "Substantive legislative experience",
      "Strong academic credentials",
      "Proven leadership and organizational skills",
      "Excellent oral and written communication skills",
      "Strong editing and proofreading skills",
      "Ability to work well under pressure",
      "Extensive knowledge of the legislative process",
      "Availability to work long hours",
      "Previous Hill experience",
      "Proven knowledge of legislative and political processes",
      "Law degree (preferred)",
      "Previous capitol hill experience in a leadership position (preferred)",
      "Florida ties (preferred)"
    ],
    "how_to_apply": "To apply, please submit cover letter and resume in one single pdf to FL24.Resumes@mail.house.gov and include “Legislative Director” in the subject line by October 31, 2018.\n\nNo phone calls or drop-ins please.",
    "salary_info": null,
    "contact": "FL24.Resumes@mail.house.gov",
    "equal_opportunity": null
  }
]