[
  {
    "id": "MEM-190-14",
    "position_title": "Communications Director",
    "office": "Senior Democrat",
    "location": "D.C.",
    "posting_date": "2014-06-02",
    "description": "Senior Democrat seeks a communications director experienced in all aspects of public relations and social media, who is also organized, energetic and creative to be based in D.C. congressional office to handle all communications strategy and media operations for an unusually busy office. This is a very fast-paced office where the communications director writes press releases; help the member with social media; pitches stories; responds to reporters' inquiries; oversees website content; develops and maintains relationships with local and national media; organizes media events; and produces newsletters and e-newsletters. Occasional help on press releases is sometimes available from legislative staff. Excellent research, writing and social media skills are essential.\nCandidate must be able to handle multiple tasks and issues effectively while meeting deadlines. A successful candidate will develop and implement a communications plan, think outside the box and possess the political savvy needed to anticipate big news stories and to proactively promote the Member's message. At least three years of prior media and/or Hill experience and demonstrated experience with both mainstream and new media outlets is preferred. This is NOT an entry level communications position. Candidate must be a DC resident or be willing to become a resident of the District of Columbia. Salary based on skill and experience level.",
    "responsibilities": [
      "Writes press releases",
      "Help the member with social media",
      "Pitches stories",
      "Responds to reporters’ inquiries",
      "Oversees website content",
      "Develops and maintains relationships with local and national media",
      "Organizes media events",
      "Produces newsletters and e-newsletters"
    ],
    "qualifications": [
      "Excellent research, writing and social media skills are essential.",
      "Ability to handle multiple tasks and issues effectively while meeting deadlines.",
      "Develop and implement a communications plan",
      "Think outside the box and possess the political savvy needed to anticipate big news stories and to proactively promote the Member’s message.",
      "At least three years of prior media and/or Hill experience and demonstrated experience with both mainstream and new media outlets is preferred.",
      "Must be a DC resident or be willing to become a resident of the District of Columbia."
    ],
    "how_to_apply": "Interested applicants should send a cover letter, resume, references and two writing samples to(202) 225-1129 (fax) or DC00.NortonResume@mail.house.gov . NO PHONE CALLS, PLEASE! If you have questions, please email them to dc00.nortonresume@mail.house.gov.",
    "salary_info": "Salary based on skill and experience level.",
    "contact": "DC00.NortonResume@mail.house.gov",
    "equal_opportunity": null
  },
  {
    "id": "MEM-189-14",
    "position_title": "Scheduler",
    "office": "Republican seeking Scheduler for Capitol Hill office",
    "location": "Capitol Hill",
    "posting_date": "2014-06-02",
    "description": "Candidate must have experience on the Hill or in private sector, be highly organized; possesses strong people skills with exceptional attention to detail and be comfortable working in a demanding and fast paced environment. \n\nResponsibilities include but not limited to: process all scheduling requests, invitations and events for Member’s calendar; respond to all invitations by written email correspondence or by personal telephone call; maintain office contact lists; make travel arrangements; handle Member correspondence; ensure the Member is provided with briefing materials for each event by coordinating with event participants and the appropriate legislative and/or district staff; and assist with other duties as assigned.",
    "responsibilities": [
      "Process all scheduling requests, invitations and events for Member’s calendar",
      "Respond to all invitations by written email correspondence or by personal telephone call",
      "Maintain office contact lists",
      "Make travel arrangements",
      "Handle Member correspondence",
      "Ensure the Member is provided with briefing materials for each event by coordinating with event participants and the appropriate legislative and/or district staff",
      "Assist with other duties as assigned"
    ],
    "qualifications": [
      "Experience on the Hill or in private sector",
      "Highly organized",
      "Possesses strong people skills with exceptional attention to detail",
      "Comfortable working in a demanding and fast paced environment"
    ],
    "how_to_apply": "Email resume and cover letter to with “Scheduler” in the subject line to PA.Resumes@mail.house.gov.",
    "salary_info": "Salary commensurate with experience.",
    "contact": "PA.Resumes@mail.house.gov",
    "equal_opportunity": null
  },
  {
    "id": "MEM-187-14",
    "position_title": "Legislative Assistant",
    "office": "Senior Democrat",
    "location": "District of Columbia",
    "posting_date": "2014-06-02",
    "description": "Senior Democrat is seeking a highly energetic, motivated and organized lawyer with strong interpersonal and writing skills. The ideal candidate will be able to manage multiple tasks and work well under pressure. The Legislative Assistant works with the Chief Counsel/Legislative Director and with the Chief of Staff to develop and implement the Member’s legislative strategy in his/her issue areas; prepares materials for hearings; drafts legislation, amendments, and congressional record statements; and conducts research. Responsibilities include managing and handling issues that include but are not limited to Federal-District of Columbia issues, Federal Workforce, U.S. Postal Service and Labor policy. The ability to write well under tight deadlines is essential.\nCandidate must be able to handle multiple tasks and issues effectively while meeting deadlines. A successful candidate will be a results-oriented problem solver and motivated self-starter who can think outside the box. Prior Hill, law firm or similar experience is preferred. Candidate must possess a law degree and be, or be willing to become, a resident of the District of Columbia. Salary based on skill and experience level.",
    "responsibilities": [
      "Managing and handling issues that include but are not limited to Federal-District of Columbia issues",
      "Federal Workforce",
      "U.S. Postal Service",
      "Labor policy"
    ],
    "qualifications": [
      "Law degree",
      "Be, or be willing to become, a resident of the District of Columbia",
      "Prior Hill, law firm or similar experience is preferred",
      "Ability to write well under tight deadlines is essential",
      "Ability to handle multiple tasks and issues effectively while meeting deadlines"
    ],
    "how_to_apply": "Interested applicants should send a cover letter, resume, references and two writing samples to (202 225-1129 (fax) or DC00.NortonResume@mail.house.gov.",
    "salary_info": "Salary based on skill and experience level.",
    "contact": "DC00.NortonResume@mail.house.gov",
    "equal_opportunity": null
  },
  {
    "id": "MEM-186-14",
    "position_title": "Field Deputy",
    "office": "District Office",
    "location": "Los Angeles, California",
    "posting_date": "2014-06-02",
    "description": "Serve as the Congressman's liaison with the community, local organizations and government agencies; staff and/or represent the Congressman at events; advise the Congressman on local issues; help organize community based meetings and events; implement proactive constituent outreach programs; prepare Member for speeches and meetings; draft correspondence.",
    "responsibilities": [
      "Serve as the Congressman's liaison with the community, local organizations and government agencies",
      "Staff and/or represent the Congressman at events",
      "Advise the Congressman on local issues",
      "Help organize community based meetings and events",
      "Implement proactive constituent outreach programs",
      "Prepare Member for speeches and meetings",
      "Draft correspondence"
    ],
    "qualifications": [
      "Prefer two years experience working directly with the community at large.",
      "Familiarity with the 34th Congressional District, key federal, state and local issues, and the governmental process is also desirable.",
      "Solid interpersonal, research and writing skills are essential.",
      "The successful applicant will be a team player, have a positive attitude and the ability to work and set priorities in a fast-paced and challenging environment.",
      "Spanish language skills considered a plus."
    ],
    "how_to_apply": "Please email cover letter and resume to Resume.California@mail.house.gov\nNo phone calls please.",
    "salary_info": "Commensurate with experience and salary history.",
    "contact": "Resume.California@mail.house.gov",
    "equal_opportunity": null
  }
]