[
  {
    "id": "MEM-437-19",
    "position_title": "Staff Assistant and Driver",
    "office": "Congressman Jimmy Gomez (CA34)",
    "location": "Washington DC",
    "posting_date": "2019-09-09",
    "description": "The Office of Congressman Jimmy Gomez (CA34) seeks an organized, passionate, team-oriented Staff Assistant and Driver for the Washington DC office. Responsibilities include: managing the front office, coordinating tour and flag requests, managing DC internship program, driving the Congressman to and from events, and providing additional office support as needed. While this is an entry-level position, candidates should have excellent oral and written communication skills, great attention to detail, strong time management skills, and an ability to work under pressure to meet tight deadlines. A valid driver's license, daily access to an automobile and a good driving record are a necessity.",
    "responsibilities": [
      "managing the front office",
      "coordinating tour and flag requests",
      "managing DC internship program",
      "driving the Congressman to and from events",
      "providing additional office support as needed"
    ],
    "qualifications": [
      "excellent oral and written communication skills",
      "great attention to detail",
      "strong time management skills",
      "an ability to work under pressure to meet tight deadlines",
      "A valid driver’s license",
      "daily access to an automobile",
      "a good driving record"
    ],
    "how_to_apply": "Please send resume and two writing samples to Gomez.Jobs@mail.house.gov with “Staff Assistant” in the subject line. No calls or drop-ins please.",
    "salary_info": null,
    "contact": "Gomez.Jobs@mail.house.gov",
    "equal_opportunity": "Equal Employment Opportunity Employer."
  },
  {
    "id": "MEM-252-19",
    "position_title": "Legislative Counsel",
    "office": "Rep. Justin Amash (MI-03)",
    "location": "Washington, DC",
    "posting_date": "2019-09-09",
    "description": "The Office of Rep. Justin Amash (MI-03) is seeking a bright, creative, and\nself-motivated legislative counsel to join our Washington, DC-based policy\nteam.\n\nThe legislative counsel will draft legislation, analyze bills, and meet with\nconstituents concerning policy matters, among other duties. The person will\nbe expected to handle a diverse portfolio of policy issues.\n\nThe successful applicant will be a libertarian or classical liberal in the\ntradition of F.A. Hayek, Henry Hazlitt, and Frederic Bastiat. The applicant\nmust demonstrate a strong commitment to individual liberty, economic\nfreedom, the Rule of Law, and the Constitution.\n\nThe person also must be an excellent writer and clear thinker willing to take\non the most serious impediments to a freer, more prosperous America. An\nindividual who prefers staid and steady work or who avoids challenges (and\nthe occasional failure) may be more comfortable elsewhere.\n",
    "responsibilities": [
      "Draft legislation",
      "Analyze bills",
      "Meet with constituents concerning policy matters",
      "Handle a diverse portfolio of policy issues"
    ],
    "qualifications": [
      "Applicants must have a JD or equivalent.",
      "Two years of relevant policy experience is preferred, although Hill experience is not required."
    ],
    "how_to_apply": "To apply, please send a resume, cover letter, and two writing samples to\napplydc@amash.com. Please include \"legislative counsel applicant\" in the\nsubject line. No walk-in applicants or phone interviews.",
    "salary_info": null,
    "contact": "applydc@amash.com",
    "equal_opportunity": null
  }
]